titulo,enlace
Consejo de Participación Ciudadana anuncia sesión extraordinaria por sentencia de Corte Constitucional sobre Superintendente de Bancos,https://notimundo.com.ec/consejo-de-participacion-ciudadana-anuncia-sesion-extraordinaria-por-sentencia-de-corte-constitucional-sobre-superintendente-de-bancos/
Presidente de Colombia ordena aumentar aranceles en 25% a importaciones estadounidenses,https://notimundo.com.ec/presidente-de-colombia-ordena-aumentar-aranceles-en-25-a-importaciones-estadounidenses/
Pleno de la Asamblea Nacional calificó proyecto urgente sobre emprendimiento de las mujeres,https://notimundo.com.ec/pleno-de-la-asamblea-nacional-califico-proyecto-urgente-sobre-emprendimiento-de-las-mujeres/
Caso Ligados: Fiscalía rechaza ‘tergiversación o desinformación’ luego de los allanamientos a la sede del Consejo de Participación Ciudadana,https://notimundo.com.ec/caso-ligados-fiscalia-rechaza-tergiversacion-o-desinformacion-luego-de-los-allanamientos-a-la-sede-del-consejo-de-participacion-ciudadana/
Trump dice que impondrá sanciones a Colombia por la negativa de Petro a recibir dos aviones militares con deportados colombianos,https://notimundo.com.ec/trump-dice-que-impondra-sanciones-a-colombia-por-la-negativa-de-petro-a-recibir-dos-aviones-militares-con-deportados-colombianos/
Presidente Petro anuncia que devolvió aviones militares estadounidenses que llevaban inmigrantes deportados a Colombia,https://notimundo.com.ec/presidente-petro-anuncia-que-devolvio-aviones-militares-estadounidenses-que-llevaban-inmigrantes-deportados-a-colombia/
Eduardo Franco Loor justifica las decisiones de la ‘Liga Azul’ y asegura que los consejeros no incurrieron en delitos,https://notimundo.com.ec/eduardo-franco-loor-justifica-las-decisiones-de-la-liga-azul-y-asegura-que-no-ha-existido-ningun-delito-cometido-por-los-cuatro-consejeros/
"Retraso en pagos a dializadoras pone en riesgo la vida de 17 mil pacientes renales, alerta representante de Pichincha",https://notimundo.com.ec/retraso-en-pagos-a-dializadoras-pone-en-riesgo-la-vida-de-17-mil-pacientes-renales-alerta-representante-de-pichincha/
"Candidatas al Parlamento Andino, proponen que las resoluciones adoptadas sean vinculantes y válidas para la Asamblea Nacional",https://notimundo.com.ec/candidatas-al-parlamento-andino-proponen-que-las-resoluciones-adoptadas-sean-vinculantes-y-validas-para-la-asamblea-nacional/
"El Caso ‘Ligados’ demuestra el “fracaso” institucional del CPCCS; hay que eliminarlo, insiste Germán Rodas",https://notimundo.com.ec/el-caso-ligados-demuestra-el-fracaso-institucional-del-cpccs-hay-que-eliminarlo-insiste-german-rodas/
“Make Ecuador Arrecho Again”: Enrique Gómez promete la implementación de muros tecnológicos,https://notimundo.com.ec/make-ecuador-arrecho-again-enrique-gomez-promete-la-implementacion-de-muros-tecnologicos/
"Eliminación del CPCCS, reforma judicial y un plan de descentralización, las propuestas de Carlos Rabascall para la Presidencia",https://notimundo.com.ec/eliminacion-del-cpccs-reforma-judicial-y-un-plan-de-descentralizacion-las-propuestas-de-carlos-rabascall-para-la-presidencia/
Consejo de Participación Ciudadana anuncia sesión extraordinaria por sentencia de Corte Constitucional sobre Superintendente de Bancos,https://notimundo.com.ec/consejo-de-participacion-ciudadana-anuncia-sesion-extraordinaria-por-sentencia-de-corte-constitucional-sobre-superintendente-de-bancos/
Presidente de Colombia ordena aumentar aranceles en 25% a importaciones estadounidenses,https://notimundo.com.ec/presidente-de-colombia-ordena-aumentar-aranceles-en-25-a-importaciones-estadounidenses/
Pleno de la Asamblea Nacional calificó proyecto urgente sobre emprendimiento de las mujeres,https://notimundo.com.ec/pleno-de-la-asamblea-nacional-califico-proyecto-urgente-sobre-emprendimiento-de-las-mujeres/
Caso Ligados: Fiscalía rechaza ‘tergiversación o desinformación’ luego de los allanamientos a la sede del Consejo de Participación Ciudadana,https://notimundo.com.ec/caso-ligados-fiscalia-rechaza-tergiversacion-o-desinformacion-luego-de-los-allanamientos-a-la-sede-del-consejo-de-participacion-ciudadana/
"‘Bambi’ cobró vida en la pantalla grande, pero no tiene nada que ver con Disney",https://notimundo.com.ec/bambi-cobro-vida-en-la-pantalla-grande-pero-no-tiene-nada-que-ver-con-disney/
"TCL lanza AI ME, el primer robot familiar de compañía con inteligencia artificial",https://notimundo.com.ec/tcl-lanza-ai-me-el-primer-robot-familiar-de-compania-con-inteligencia-artificial/
"Tras 15 meses de conflicto, Israel y Hamás llegaron a un acuerdo de cese al fuego",https://notimundo.com.ec/tras-15-meses-de-conflicto-israel-y-hamas-llegaron-a-un-acuerdo-de-cese-al-fuego/
Consejo de Participación Ciudadana anuncia sesión extraordinaria por sentencia de Corte Constitucional sobre Superintendente de Bancos,https://notimundo.com.ec/consejo-de-participacion-ciudadana-anuncia-sesion-extraordinaria-por-sentencia-de-corte-constitucional-sobre-superintendente-de-bancos/
Presidente de Colombia ordena aumentar aranceles en 25% a importaciones estadounidenses,https://notimundo.com.ec/presidente-de-colombia-ordena-aumentar-aranceles-en-25-a-importaciones-estadounidenses/
Pleno de la Asamblea Nacional calificó proyecto urgente sobre emprendimiento de las mujeres,https://notimundo.com.ec/pleno-de-la-asamblea-nacional-califico-proyecto-urgente-sobre-emprendimiento-de-las-mujeres/
Caso Ligados: Fiscalía rechaza ‘tergiversación o desinformación’ luego de los allanamientos a la sede del Consejo de Participación Ciudadana,https://notimundo.com.ec/caso-ligados-fiscalia-rechaza-tergiversacion-o-desinformacion-luego-de-los-allanamientos-a-la-sede-del-consejo-de-participacion-ciudadana/
Trump dice que impondrá sanciones a Colombia por la negativa de Petro a recibir dos aviones militares con deportados colombianos,https://notimundo.com.ec/trump-dice-que-impondra-sanciones-a-colombia-por-la-negativa-de-petro-a-recibir-dos-aviones-militares-con-deportados-colombianos/
Presidente Petro anuncia que devolvió aviones militares estadounidenses que llevaban inmigrantes deportados a Colombia,https://notimundo.com.ec/presidente-petro-anuncia-que-devolvio-aviones-militares-estadounidenses-que-llevaban-inmigrantes-deportados-a-colombia/
Paola Pabón rechaza invitación de Noboa a reunirse con Edmundo González,https://notimundo.com.ec/paola-pabon-rechaza-invitacion-de-noboa-a-reunirse-con-edmundo-gonzalez/
Agente penitenciario fue asesinado en una gasolinera de Nueva Loja,https://notimundo.com.ec/agente-penitenciario-fue-asesinado-en-una-gasolinera-de-nueva-loja/
TCE archiva denuncia contra candidato Tillería por supuesta incitación al odio,https://notimundo.com.ec/tce-archiva-denuncia-contra-candidato-tilleria-por-supuesta-incitacion-al-odio/
Colombia sugiere a Venezuela enfrentar juntos al ELN,https://notimundo.com.ec/colombia-sugiere-a-venezuela-enfrentar-juntos-al-eln/
El millonario Eras Tour de Taylor Swift ha sido nombrado como “Gira del siglo”,https://notimundo.com.ec/el-millonario-eras-tour-de-taylor-swift-ha-sido-nombrado-como-gira-del-siglo/
Justin Bieber comparte foto de su hijo mientras graba música,https://notimundo.com.ec/justin-bieber-comparte-foto-de-su-hijo-mientras-graba-musica/
Ricardo Arjona revela por qué no se une al género,https://notimundo.com.ec/ricardo-arjona-revela-por-que-no-se-une-al-genero/
Demi Lovato denuncia «negocios turbios» de Meta,https://notimundo.com.ec/demi-lovato-denuncia-negocios-turbios-de-meta/
Una canción inédita de Tina Turner ha salido a la luz 40 años después,https://notimundo.com.ec/una-cancion-inedita-de-tina-turner-ha-salido-a-la-luz-40-anos-despues/
